{
  "schemaVersion": "1.0",
  "sourceId": "file-1d0cb35d72e3cd55a6c37a28a347c5e165020bdfe68ce8bde9ada54f37d4aa68",
  "title": "Aprimoramentos_Tormenta_OCR_alta_qualidade",
  "path": "Livros/word/feito/Aprimoramentos_Tormenta_OCR_alta_qualidade.docx",
  "extension": ".docx",
  "sha256": "1d0cb35d72e3cd55a6c37a28a347c5e165020bdfe68ce8bde9ada54f37d4aa68",
  "rightsStatus": "UNKNOWN",
  "visibility": "private",
  "publicationMode": "NOT_PUBLIC"
}
