{
  "schemaVersion": "1.0",
  "sourceId": "file-53b94bfe4e07a9d93c2a1b01948d531f6b1c5609f90c2f20f421b02727bd16dd",
  "title": "Arcadia_Nova_Arcadia_OCR_alta_qualidade",
  "path": "Livros/word/feito/Arcadia_Nova_Arcadia_OCR_alta_qualidade.docx",
  "extension": ".docx",
  "sha256": "53b94bfe4e07a9d93c2a1b01948d531f6b1c5609f90c2f20f421b02727bd16dd",
  "rightsStatus": "UNKNOWN",
  "visibility": "private",
  "publicationMode": "NOT_PUBLIC"
}
