{
  "schemaVersion": "1.0",
  "sourceId": "file-c4cbcb6c63145d2877148acc8e0cf55fba877ebbb7d8daf4c4578cc9eac48006",
  "title": "Juppongatana_OCR_alta_qualidade",
  "path": "Livros/word/feito/Juppongatana_OCR_alta_qualidade.docx",
  "extension": ".docx",
  "sha256": "c4cbcb6c63145d2877148acc8e0cf55fba877ebbb7d8daf4c4578cc9eac48006",
  "rightsStatus": "UNKNOWN",
  "visibility": "private",
  "publicationMode": "NOT_PUBLIC"
}
