{
  "schemaVersion": "1.0",
  "sourceId": "file-216dc621ce8040745a3765d7c86b647123894e51262d09f133e314f57f6566a6",
  "title": "animalidade",
  "path": "Livros/word/feito/animalidade.docx",
  "extension": ".docx",
  "sha256": "216dc621ce8040745a3765d7c86b647123894e51262d09f133e314f57f6566a6",
  "rightsStatus": "UNKNOWN",
  "visibility": "private",
  "publicationMode": "NOT_PUBLIC"
}
