{
  "schemaVersion": "1.0",
  "sourceId": "file-71e66dcb6765128bf8d0c8cc07af46bb5dcfe4baafd092646d1ee7a925dd4aad",
  "title": "cabala",
  "path": "Livros/word/feito/cabala.docx",
  "extension": ".docx",
  "sha256": "71e66dcb6765128bf8d0c8cc07af46bb5dcfe4baafd092646d1ee7a925dd4aad",
  "rightsStatus": "UNKNOWN",
  "visibility": "private",
  "publicationMode": "NOT_PUBLIC"
}
