{
  "schemaVersion": "1.0",
  "sourceId": "file-d202ccd8ecf6ee8436a85bcfa32a7e789bf79349e5e037f04e0d9c06a87f3441",
  "title": "Modulo_Combate_OCR_alta_qualidade",
  "path": "Livros/word/feito/Modulo_Combate_OCR_alta_qualidade.docx",
  "extension": ".docx",
  "sha256": "d202ccd8ecf6ee8436a85bcfa32a7e789bf79349e5e037f04e0d9c06a87f3441",
  "rightsStatus": "UNKNOWN",
  "visibility": "private",
  "publicationMode": "NOT_PUBLIC"
}
