{
  "schemaVersion": "1.0",
  "sourceId": "file-75982ba9b19e7c2c7db11370b6dfa678665679369f91f7bc18a0404db91011fe",
  "title": "Abismo",
  "path": "Livros/word/feito/Abismo.docx",
  "extension": ".docx",
  "sha256": "75982ba9b19e7c2c7db11370b6dfa678665679369f91f7bc18a0404db91011fe",
  "rightsStatus": "UNKNOWN",
  "visibility": "private",
  "publicationMode": "NOT_PUBLIC"
}
