{
  "schemaVersion": "1.0",
  "sourceId": "file-57dd236dd3e0a36888cc88f16a4d60f0121c9159c866a96475633e9fa2a98367",
  "title": "Corondor",
  "path": "Livros/word/feito/Corondor.docx",
  "extension": ".docx",
  "sha256": "57dd236dd3e0a36888cc88f16a4d60f0121c9159c866a96475633e9fa2a98367",
  "rightsStatus": "UNKNOWN",
  "visibility": "private",
  "publicationMode": "NOT_PUBLIC"
}
