{
  "schemaVersion": "1.0",
  "sourceId": "file-0988a565aa26707c1bdcef746b4bd188205810eb7dab0be8ad773c752f5943ff",
  "title": "Alastores - A Justiça Infernal",
  "path": "Livros/word/feito/Alastores - A Justiça Infernal.docx",
  "extension": ".docx",
  "sha256": "0988a565aa26707c1bdcef746b4bd188205810eb7dab0be8ad773c752f5943ff",
  "rightsStatus": "UNKNOWN",
  "visibility": "private",
  "publicationMode": "NOT_PUBLIC"
}
