{
  "schemaVersion": "1.0",
  "sourceId": "file-e5cf0cec76f50af51bafd7078421e43539bf570664201baf4da70dde6af72f2a",
  "title": "Aprimoramentos_1_OCR_alta_qualidade",
  "path": "Livros/word/feito/Aprimoramentos_1_OCR_alta_qualidade.docx",
  "extension": ".docx",
  "sha256": "e5cf0cec76f50af51bafd7078421e43539bf570664201baf4da70dde6af72f2a",
  "rightsStatus": "UNKNOWN",
  "visibility": "private",
  "publicationMode": "NOT_PUBLIC"
}
