{
  "schemaVersion": "1.0",
  "sourceId": "file-7440864aee0b57206dc2fe4622ec5374e79184250deb877e85bb7af09e95db4d",
  "title": "Anoes_OCR_alta_qualidade",
  "path": "Livros/word/feito/Anoes_OCR_alta_qualidade.docx",
  "extension": ".docx",
  "sha256": "7440864aee0b57206dc2fe4622ec5374e79184250deb877e85bb7af09e95db4d",
  "rightsStatus": "UNKNOWN",
  "visibility": "private",
  "publicationMode": "NOT_PUBLIC"
}
