{
  "schemaVersion": "1.0",
  "sourceId": "file-c1022a3730b54bf171bf289244cbc638576b3b56a50d6d433e4eecce84117077",
  "title": "Aprimoramentos_3_OCR_alta_qualidade",
  "path": "Livros/word/feito/Aprimoramentos_3_OCR_alta_qualidade.docx",
  "extension": ".docx",
  "sha256": "c1022a3730b54bf171bf289244cbc638576b3b56a50d6d433e4eecce84117077",
  "rightsStatus": "UNKNOWN",
  "visibility": "private",
  "publicationMode": "NOT_PUBLIC"
}
