{
  "schemaVersion": "1.0",
  "sourceId": "file-28ec91d5f865d6853a23951b5dd24ba147fb10687bb3581e9aebd33e838f26ec",
  "title": "Anjos - Réquiem de Fé",
  "path": "Livros/word/Anjos - Réquiem de Fé.docx",
  "extension": ".docx",
  "sha256": "28ec91d5f865d6853a23951b5dd24ba147fb10687bb3581e9aebd33e838f26ec",
  "rightsStatus": "UNKNOWN",
  "visibility": "private",
  "publicationMode": "NOT_PUBLIC"
}
