{
  "schemaVersion": "1.0",
  "sourceId": "file-093c982cc7c9e2df5d2a2c5aaf75187a408ec5a8e82f96ea73fc3976b31ab6af",
  "title": "Kits Orientais",
  "path": "Livros/word/feito/Kits Orientais.docx",
  "extension": ".docx",
  "sha256": "093c982cc7c9e2df5d2a2c5aaf75187a408ec5a8e82f96ea73fc3976b31ab6af",
  "rightsStatus": "UNKNOWN",
  "visibility": "private",
  "publicationMode": "NOT_PUBLIC"
}
