{
  "schemaVersion": "1.0",
  "sourceId": "file-2eb203e6adb059d3324465b3f675e3d8f5563fce05b4cb8b40ec86e9b1fd4bb3",
  "title": "Anjos Jyhad - Faces da Fé",
  "path": "Livros/word/Anjos Jyhad - Faces da Fé.docx",
  "extension": ".docx",
  "sha256": "2eb203e6adb059d3324465b3f675e3d8f5563fce05b4cb8b40ec86e9b1fd4bb3",
  "rightsStatus": "UNKNOWN",
  "visibility": "private",
  "publicationMode": "NOT_PUBLIC"
}
