{
  "schemaVersion": "1.0",
  "sourceId": "file-19a866d769848a5937d19aa1578d07debba507505166f0e3e45e30634034dbc1",
  "title": "Monges_Daemon_OCR_alta_qualidade",
  "path": "Livros/word/feito/Monges_Daemon_OCR_alta_qualidade.docx",
  "extension": ".docx",
  "sha256": "19a866d769848a5937d19aa1578d07debba507505166f0e3e45e30634034dbc1",
  "rightsStatus": "UNKNOWN",
  "visibility": "private",
  "publicationMode": "NOT_PUBLIC"
}
