{
  "schemaVersion": "1.0",
  "sourceId": "file-c5932976320eae825de2ff192a5cb9baf63678be2b31d0d230564cfd2c9610b0",
  "title": "Daemon_Medieval_OCR_alta_qualidade",
  "path": "Livros/word/Daemon_Medieval_OCR_alta_qualidade.docx",
  "extension": ".docx",
  "sha256": "c5932976320eae825de2ff192a5cb9baf63678be2b31d0d230564cfd2c9610b0",
  "rightsStatus": "UNKNOWN",
  "visibility": "private",
  "publicationMode": "NOT_PUBLIC"
}
