{
  "schemaVersion": "1.0",
  "sourceId": "file-84ebbb5dd44e90b6cafcc9a832cb87e5c02452e6768dec80a04177f184945864",
  "title": "Arcanis_OCR_alta_qualidade",
  "path": "Livros/word/feito/Arcanis_OCR_alta_qualidade.docx",
  "extension": ".docx",
  "sha256": "84ebbb5dd44e90b6cafcc9a832cb87e5c02452e6768dec80a04177f184945864",
  "rightsStatus": "UNKNOWN",
  "visibility": "private",
  "publicationMode": "NOT_PUBLIC"
}
