{
  "schemaVersion": "1.0",
  "sourceId": "file-43b5d7962610622309958dadb86e31109ec149622be09a1c42a6cea5ee7b31c3",
  "title": "Vantagens",
  "path": "Livros/word/feito/Vantagens.docx",
  "extension": ".docx",
  "sha256": "43b5d7962610622309958dadb86e31109ec149622be09a1c42a6cea5ee7b31c3",
  "rightsStatus": "UNKNOWN",
  "visibility": "private",
  "publicationMode": "NOT_PUBLIC"
}
