{
  "schemaVersion": "1.0",
  "sourceId": "file-45a231be2c63d0c7a68d8abaf6a9b177a129b015ab3fd6401b73ae31f23cb7d1",
  "title": "4killers",
  "path": "Livros/word/feito/4killers.docx",
  "extension": ".docx",
  "sha256": "45a231be2c63d0c7a68d8abaf6a9b177a129b015ab3fd6401b73ae31f23cb7d1",
  "rightsStatus": "UNKNOWN",
  "visibility": "private",
  "publicationMode": "NOT_PUBLIC"
}
