{
  "schemaVersion": "1.0",
  "sourceId": "file-0128b83f94eea09fa2b81664cba24370ce0d691b9d46d87c673812214fdb8588",
  "title": "Masmorras",
  "path": "Livros/word/feito/Masmorras.docx",
  "extension": ".docx",
  "sha256": "0128b83f94eea09fa2b81664cba24370ce0d691b9d46d87c673812214fdb8588",
  "rightsStatus": "UNKNOWN",
  "visibility": "private",
  "publicationMode": "NOT_PUBLIC"
}
