{
  "schemaVersion": "1.0",
  "sourceId": "file-7822aebc3d20aca51fee54dc8126b4bead885100760b5d28eea111ebda5304db",
  "title": "Anjos - A Cidade de Prata - Angélicos Sicários",
  "path": "Livros/word/Anjos - A Cidade de Prata - Angélicos Sicários.docx",
  "extension": ".docx",
  "sha256": "7822aebc3d20aca51fee54dc8126b4bead885100760b5d28eea111ebda5304db",
  "rightsStatus": "UNKNOWN",
  "visibility": "private",
  "publicationMode": "NOT_PUBLIC"
}
