{
  "schemaVersion": "1.0",
  "sourceId": "file-22617317e0be65a150d3631365e1114c609730b263ca708477c7470338f11a56",
  "title": "Aprimoramentos_4_OCR_alta_qualidade",
  "path": "Livros/word/feito/Aprimoramentos_4_OCR_alta_qualidade.docx",
  "extension": ".docx",
  "sha256": "22617317e0be65a150d3631365e1114c609730b263ca708477c7470338f11a56",
  "rightsStatus": "UNKNOWN",
  "visibility": "private",
  "publicationMode": "NOT_PUBLIC"
}
