{
  "schemaVersion": "1.0",
  "sourceId": "file-876c4eb1b4260e3e671d6e65cacf2c1d08de44574f4433b8e4bea99d40d2ee19",
  "title": "Phage",
  "path": "Livros/word/feito/Phage.docx",
  "extension": ".docx",
  "sha256": "876c4eb1b4260e3e671d6e65cacf2c1d08de44574f4433b8e4bea99d40d2ee19",
  "rightsStatus": "UNKNOWN",
  "visibility": "private",
  "publicationMode": "NOT_PUBLIC"
}
